Project ID,Scene ID,Scene Type,Time (Start-End),Target Duration,Subtitle,Voice Text,Visual Cue,Subtitle Style,Advanced Effect,Transition Out
"VID_20260603_180225","scene_001","hook","0s - 14s","3.5s","BÍ QUYẾT LÀM SẠCH GIÀY ĐẾN 99%","Giày đi lâu ngày bị bẩn cứng đầu? Đừng lo, đây là cách xử lý siêu nhanh.","Người thực hiện đang dùng bàn chải đánh răng chà xát mạnh mẽ lên phần viền đế giày có màu sắc sặc sỡ để tạo bọt làm sạch ban đầu.","hook_bold (top)","Fast Motion (push_in)","wipe_left (0.4s)"
"VID_20260603_180225","scene_002","body","14s - 29s","5s","LAU SẠCH BỌT BẨN BAN ĐẦU","Dùng miếng xốp lau nhẹ là đi ngay lớp bụi bẩn bám trên bề mặt rồi.","Sử dụng một miếng mút xốp trắng để lau đi lượng bọt bẩn vừa chà ra trên bề mặt đế giày, để lộ phần cao su đang dần sạch hơn.","framed_card (top)","Satisfying Timewarp (static)","wipe_right (0.4s)"
"VID_20260603_180225","scene_003","body","29s - 44s","6s","SỬ DỤNG DUNG DỊCH CHUYÊN DỤNG","Bây giờ kết hợp thêm dung dịch làm sạch chuyên sâu này nhé.","Lắp vòi xịt vào chai dung dịch tẩy rửa chuyên dụng màu đen và chuẩn bị phun trực tiếp lên các vết ố vàng còn lại.","framed_card (top)","Cinematic Zoom (push_in)","fade (0.3s)"
"VID_20260603_180225","scene_004","body","44s - 101s","6.5s","CHÀ SẠCH CÁC KẼ NHỎ","Chà kỹ vào phần đế, những vết ố vàng cứng đầu nhất cũng phải đầu hàng.","Dùng mút xốp thấm dung dịch chà xát liên tục vào các góc cạnh, kẽ hở nhỏ sát mép vải của đôi giày.","framed_card (top)","Jump Cuts (pulse)","slide_up (0.4s)"
"VID_20260603_180225","scene_005","body","101s - 115s","5s","TĂNG CƯỜNG LÀM SẠCH ĐẾ","Thêm một chút dung dịch nữa để đánh bay hoàn toàn các vết bám lâu năm.","Đổ thêm một ít dung dịch tẩy rửa trực tiếp lên miếng mút xốp rồi tiếp tục chà mạnh tay lên toàn bộ phần đế viền xung quanh.","framed_card (top)","Speed Up (static)","circle_open (0.5s)"
"VID_20260603_180225","scene_006","conclusion","115s - 129s","6s","ĐẾ GIÀY TRẮNG SÁNG NHƯ MỚI","Nhìn xem, phần đế giày đã trắng sáng tinh tươm trở lại rồi. Thử ngay công thức này nhé!","Người thực hiện đặt đôi giày xuống bàn, phần đế cao su trắng sáng rõ rệt, sạch sẽ hoàn toàn so với lúc đầu.","cta_red (top)","Epic Reveal (push_out)","fade (0.3s)"
