Project ID,Scene ID,Scene Type,Time (Start-End),Target Duration,Subtitle,Voice Text,Visual Cue,Subtitle Style,Advanced Effect,Transition Out
"VID_20260624_092630","scene_008","conclusion","35s - 38s","3s","BẠN ĐÃ CÓ EM NÀY CHƯA?","Các bạn thấy em này thế nào, để lại ý kiến bên dưới nhé!","Góc quay tĩnh từ xa toàn bộ đôi dép ngay ngắn xinh xắn kết thúc","cta_red (bottom)","Cinematic Zoom (push_out)","fade (0.2s)"
"VID_20260625_123258","scene_004","conclusion","55s - 62s","7s","Chiếu sáng sân vườn cực chất!","Với chiếc đèn pha LED này, mọi góc tối đều sẽ được chiếu sáng bừng, rất đáng để đầu tư!","Final shots of the LED flood light, showing its design and potential use.","hook_bold (bottom)","Glow (static)","fade (0.4s)"
"VID_20260625_123258","scene_001","hook","4s - 32s","28s","Mở hộp đèn LED 50W cực đã!","Mới nhận được gói hàng này, nghe nói là đèn LED công suất lớn, cùng tôi khám phá nào!","Hands cutting and removing bubble wrap, revealing product box.","hook_bold (top)","Speed Up (snap)","wipe_right (0.4s)"
"VID_20260625_123258","scene_002","body","32s - 46s","14s","Đèn LED 50W, chống nước IP66","Đây rồi, chiếc đèn LED 50W chuẩn IP66, chống nước hoàn hảo cho mọi điều kiện thời tiết.","Opening box, pulling out the flood light, showing its front.","framed_card (top)","Cinematic Zoom (push_in)","circle_open (0.3s)"
"VID_20260625_123258","scene_003","body","46s - 55s","9s","Dây chắc chắn, khung linh hoạt!","Dây điện bọc chắc chắn và khung đỡ có thể điều chỉnh xoay 180 độ, cực kỳ tiện lợi để lắp đặt.","Showing exposed wires and adjusting the black metal stand.","neon_glow (top)","Smooth Transition (drift)","slide_up (0.35s)"
"VID_20260625_123258","scene_004","conclusion","55s - 62s","7s","Chiếu sáng sân vườn cực chất!","Với chiếc đèn pha LED này, mọi góc tối đều sẽ được chiếu sáng bừng, rất đáng để đầu tư!","Final shots of the LED flood light, showing its design and potential use.","cta_red (bottom)","Glow (static)","fade (0.4s)"
"VID_20260616_113203","scene_006","conclusion","73s - 85s","7s","HÃY CHĂM SÓC ĐỒ DA CỦA BẠN","Đừng quên bảo quản và vệ sinh những món đồ da yêu thích thường xuyên để giữ chúng bền đẹp theo thời gian nhé!","Đóng nắp hũ sáp nhôm lại tỉ mỉ và đặt cạnh miếng mút vàng trên chiếc thớt da màu xanh lục.","hook_bold (top)","Cinematic Zoom (push_out)","fade (0.5s)"
"VID_20260616_113203","scene_001","hook","0s - 9s","4s","UNBOXING HỘP QUÀ BÍ ẨN CHO ĐỒ DA","Hôm nay cùng mình khui một chiếc hộp cực kỳ đặc biệt dành riêng cho các tín đồ mê đồ da nhé.","Cận cảnh bàn tay cầm hộp giấy carton nhỏ, chuẩn bị dùng dao rọc giấy sắc bén.","hook_bold (top)","Epic Reveal (push_in)","wipe_left (0.3s)"
"VID_20260616_113203","scene_002","body","9s - 20s","5s","ĐƯỜNG CẮT SẮC BÉN CỰC KỲ ĐÃ TAI","Cảm giác rạch lớp băng keo siêu mượt bằng một cây dao rọc chuyên dụng.","Dao rọc giấy rạch dứt khoát qua lớp băng keo xanh trên hộp giấy.","neon_glow (top)","Satisfying Timewarp (static)","fade (0.3s)"
"VID_20260616_113203","scene_003","body","20s - 52s","8s","BÊN TRONG CÓ GÌ NÀO","Hộp giấy đi kèm một miếng xốp tròn và một hũ sáp được bọc chống sốc vô cùng chắc chắn.","Lấy hũ kim loại được bọc chống sốc dán keo xanh ra khỏi hộp cùng miếng mút xốp màu vàng.","framed_card (top)","Fast Motion (pulse)","wipe_right (0.3s)"
"VID_20260616_113203","scene_004","body","52s - 65s","6s","SÁP DƯỠNG DA SHOES UP CAO CẤP","Và đây là hũ Shoes Up Leather Soap, sản phẩm sáp chuyên dụng để làm sạch và làm mới đồ da hiệu quả.","Mở nắp hũ nhôm tròn, để lộ lớp sáp xà phòng dưỡng màu trắng mịn màng bên trong.","gold_caption (top)","Epic Reveal (push_in)","fade (0.3s)"
"VID_20260616_113203","scene_005","body","65s - 73s","5s","CHẤT SÁP MỀM MỊN ĐÁNG KINH NGẠC","Chất sáp cực mịn, dùng kèm miếng xốp xoa nhẹ là đã có thể lấy đều sáp để chuẩn bị lau rồi.","Dùng miếng mút vàng quét nhẹ một vòng tròn trên bề mặt sáp trắng mướt.","framed_card (top)","Satisfying Timewarp (drift)","slide_up (0.3s)"
"VID_20260616_113203","scene_006","conclusion","73s - 85s","7s","HÃY CHĂM SÓC ĐỒ DA CỦA BẠN","Đừng quên bảo quản và vệ sinh những món đồ da yêu thích thường xuyên để giữ chúng bền đẹp theo thời gian nhé!","Đóng nắp hũ sáp nhôm lại tỉ mỉ và đặt cạnh miếng mút vàng trên chiếc thớt da màu xanh lục.","cta_red (top)","Cinematic Zoom (push_out)","fade (0.5s)"
